<?xml version="1.0" encoding="UTF-8"?>

<!--
  XML DTD for the Aspectran Configuration File, Version 6.0

  Copyright 2008-2020 The Aspectran Project

  This DTD module is identified by the PUBLIC and SYSTEM identifiers:

  PUBLIC "-//ASPECTRAN//DTD Aspectran 6.0//EN"
  SYSTEM "http://aspectran.github.io/dtd/aspectran-6.dtd">

  XML documents that conform to this DTD should declare the following doctype:

  <!DOCTYPE aspectran PUBLIC "-//ASPECTRAN//DTD Aspectran 6.0//EN"
          "http://aspectran.github.io/dtd/aspectran-6.dtd">
-->

<!ELEMENT aspectran (
  description*,
  settings?,
  (typeAliases | environment | aspect | bean | template | schedule | translet | append)*
)>

<!ELEMENT description (#PCDATA)>
<!ATTLIST description
  profile CDATA #IMPLIED
  style   (apon | compact | compressed) #IMPLIED
>

<!ELEMENT settings (setting+)>
<!ELEMENT setting EMPTY>
<!ATTLIST setting
  name    CDATA #REQUIRED
  value   CDATA #REQUIRED
>

<!ELEMENT typeAliases (typeAlias+)>
<!ELEMENT typeAlias EMPTY>
<!ATTLIST typeAlias
  alias   CDATA #REQUIRED
  type    CDATA #REQUIRED
>

<!ELEMENT environment (description*, properties+)>
<!ATTLIST environment
  profile CDATA #IMPLIED
>

<!ELEMENT aspect (description*, joinpoint?, settings?, advice?, exception?)>
<!ATTLIST aspect
  id       ID #IMPLIED
  order    CDATA #IMPLIED
  isolated (true | false) #IMPLIED
  disabled (true | false) #IMPLIED
>

<!ELEMENT joinpoint (#PCDATA)>
<!ATTLIST joinpoint
  target  (activity | method) #IMPLIED
>

<!ELEMENT advice (before?, after?, around?, finally?)>
<!ATTLIST advice
  bean    CDATA #IMPLIED
>

<!ELEMENT before  (headers | echo | (action | invoke))>
<!ELEMENT after   (headers | echo | (action | invoke))>
<!ELEMENT around  (action | invoke)>
<!ELEMENT finally (thrown?, (headers | echo | (action | invoke)))>

<!ELEMENT exception (description*, thrown+)>

<!ELEMENT thrown ((headers | echo | (action | invoke)?)?, (transform | dispatch | redirect)*)>
<!ATTLIST thrown
  type    CDATA #IMPLIED
>

<!ELEMENT bean (description*, filter?, arguments*, properties*)>
<!ATTLIST bean
  id            CDATA #IMPLIED
  class         CDATA #IMPLIED
  scan          CDATA #IMPLIED
  mask          CDATA #IMPLIED
  factoryBean   CDATA #IMPLIED
  factoryMethod CDATA #IMPLIED
  initMethod    CDATA #IMPLIED
  destroyMethod CDATA #IMPLIED
  scope         (singleton | prototype | request | session) #IMPLIED
  singleton     (true | false) #IMPLIED
  lazyInit      (true | false) #IMPLIED
  lazyDestroy   (true | false) #IMPLIED
  important     (true | false) #IMPLIED
>

<!ELEMENT filter (#PCDATA)>
<!ATTLIST filter
  class   CDATA #IMPLIED
>

<!ELEMENT schedule (description*, scheduler, job*)>
<!ATTLIST schedule
  id      ID #IMPLIED
>

<!ELEMENT scheduler (trigger)>
<!ATTLIST scheduler
  bean    CDATA #IMPLIED
>

<!ELEMENT trigger (#PCDATA)>
<!ATTLIST trigger
  type    CDATA #IMPLIED
>

<!ELEMENT job EMPTY>
<!ATTLIST job
  translet CDATA #REQUIRED
  disabled (true | false) #IMPLIED
>

<!ELEMENT translet (
  description*,
  (request? | (parameters*, attributes*)),
  ((contents | content)? | (choose | headers | echo | action | include)*),
  (response* | (transform | dispatch | forward | redirect)?),
  exception?
)>
<!ATTLIST translet
  name    CDATA #REQUIRED
  scan    CDATA #IMPLIED
  mask    CDATA #IMPLIED
  method  CDATA #IMPLIED
>

<!ELEMENT request (parameters*, attributes*)>
<!ATTLIST request
  method   CDATA #IMPLIED
  encoding CDATA #IMPLIED
>

<!ELEMENT contents (content*)>
<!ATTLIST contents
  name      CDATA #IMPLIED
>

<!ELEMENT content (choose | headers | echo | action | include)*>
<!ATTLIST content
  name      CDATA #IMPLIED
>

<!ELEMENT choose (when*, otherwise?)>

<!ELEMENT when ((headers | echo | action | include | choose)*, (transform | dispatch | forward | redirect)?)>
<!ATTLIST when
  test    CDATA #IMPLIED
>

<!ELEMENT otherwise ((headers | echo | action | include | choose)*, (transform | dispatch | forward | redirect)?)>

<!ELEMENT headers (item*)>
<!ATTLIST headers
  id      CDATA #IMPLIED
  hidden  (true | false) #IMPLIED
>

<!ELEMENT echo (item*)>
<!ATTLIST echo
  id      CDATA #IMPLIED
  hidden  (true | false) #IMPLIED
>

<!ELEMENT action (arguments*, properties*)>
<!ATTLIST action
  id      CDATA #IMPLIED
  bean    CDATA #REQUIRED
  method  CDATA #REQUIRED
  hidden  (true | false) #IMPLIED
>

<!ELEMENT invoke (arguments*, properties*)>
<!ATTLIST invoke
  method  CDATA #REQUIRED
  hidden  (true | false) #IMPLIED
>

<!ELEMENT include (parameters*, attributes*)>
<!ATTLIST include
  id       CDATA #IMPLIED
  translet CDATA #REQUIRED
  method   CDATA #IMPLIED
  hidden   (true | false) #IMPLIED
>

<!ELEMENT response ((choose | headers | echo | action | include)*, (transform | dispatch | forward | redirect)?)>
<!ATTLIST response
  name     CDATA #IMPLIED
  encoding CDATA #IMPLIED
>

<!ELEMENT transform (template?)>
<!ATTLIST transform
  format      CDATA #IMPLIED
  contentType CDATA #IMPLIED
  encoding    CDATA #IMPLIED
  default     (true | false) #IMPLIED
  pretty      (true | false) #IMPLIED
>

<!ELEMENT dispatch EMPTY>
<!ATTLIST dispatch
  name        CDATA #REQUIRED
  dispatcher  CDATA #IMPLIED
  contentType CDATA #IMPLIED
  encoding    CDATA #IMPLIED
  default     (true | false) #IMPLIED
>

<!ELEMENT forward (attributes*)>
<!ATTLIST forward
  contentType CDATA #IMPLIED
  translet    CDATA #REQUIRED
  method      CDATA #IMPLIED
  default     (true | false) #IMPLIED
>

<!ELEMENT redirect (parameters*)>
<!ATTLIST redirect
  contentType            CDATA #IMPLIED
  path                   CDATA #REQUIRED
  encoding               CDATA #IMPLIED
  excludeNullParameters  (true | false) #IMPLIED
  excludeEmptyParameters (true | false) #IMPLIED
  default                (true | false) #IMPLIED
>

<!ELEMENT parameters (item*)>
<!ATTLIST parameters
  profile CDATA #IMPLIED
>

<!ELEMENT attributes (item*)>
<!ATTLIST attributes
  profile CDATA #IMPLIED
>

<!ELEMENT properties (item*)>
<!ATTLIST properties
  profile CDATA #IMPLIED
>

<!ELEMENT arguments (item*)>
<!ATTLIST arguments
  profile CDATA #IMPLIED
>

<!ELEMENT item (#PCDATA | value | entry | bean)*>
<!ATTLIST item
  type         (single | array | list | map | set | properties) #IMPLIED
  name         CDATA #IMPLIED
  value        CDATA #IMPLIED
  valueType    (string | int | long | float | double | boolean | parameters | file | multipart-file | bean) #IMPLIED
  tokenize     (true | false) #IMPLIED
  mandatory    (true | false) #IMPLIED
  secret       (true | false) #IMPLIED
>

<!ELEMENT value (#PCDATA | bean)*>

<!ELEMENT entry (#PCDATA | bean)*>
<!ATTLIST entry
  name     CDATA #IMPLIED
  value    CDATA #IMPLIED
  tokenize (true | false) #IMPLIED
>

<!ELEMENT template (#PCDATA)>
<!ATTLIST template
  id       CDATA #IMPLIED
  engine   CDATA #IMPLIED
  style    (apon | compact | compressed) #IMPLIED
  name     CDATA #IMPLIED
  file     CDATA #IMPLIED
  resource CDATA #IMPLIED
  url      CDATA #IMPLIED
  encoding CDATA #IMPLIED
  noCache  (true | false) #IMPLIED
>

<!ELEMENT append EMPTY>
<!ATTLIST append
  file     CDATA #IMPLIED
  resource CDATA #IMPLIED
  url      CDATA #IMPLIED
  format   (xml | apon) #IMPLIED
  profile  CDATA #IMPLIED
>
