<?xml version="1.0" encoding="UTF-8"?>
<!DOCTYPE aspectran PUBLIC "-//ASPECTRAN//DTD Aspectran Configuration 6.0//EN"
        "http://aspectran.github.io/dtd/aspectran-6.dtd">
<aspectran>

    <description>
        An Aspectran configuration for Embedded Jetty Server.
    </description>

    <environment>
        <properties>
            <item name="jetty.startup" value="true" valueType="boolean"/>
            <item name="jetty.server.port" value="8080" valueType="int"/>
            <item name="jetty.server.minThreads" value="3" valueType="int"/>
            <item name="jetty.server.maxThreads" value="10" valueType="int"/>
            <item name="jetty.session.dataStoreDir" value="#{basePath}/temp/sessions/jetty"/>
            <item name="jetty.gzip.minGzipSize" value="20000" valueType="int"/>
            <item name="jetty.gzip.inflateBufferSize" value="0" valueType="int"/>
            <item name="jetty.gzip.deflaterPoolCapacity" value="-1" valueType="int"/>
            <item name="jetty.gzip.syncFlush" value="false" valueType="boolean"/>
            <item name="jetty.gzip.includedMethodList" value="GET"/>
            <item name="jetty.gzip.excludedMethodList" value=""/>
        </properties>
    </environment>

    <bean id="jetty.server" class="com.aspectran.jetty.JettyServer">
        <arguments>
            <item name="threadPool">
                <bean class="org.eclipse.jetty.util.thread.QueuedThreadPool">
                    <properties>
                        <item name="minThreads">%{jetty.server.minThreads}</item>
                        <item name="maxThreads">%{jetty.server.maxThreads}</item>
                    </properties>
                </bean>
            </item>
        </arguments>
        <properties>
            <item name="autoStart">%{jetty.startup}</item>
            <item name="connectors" type="array">
                <bean class="org.eclipse.jetty.server.ServerConnector">
                    <arguments>
                        <item>#{jetty.server}</item>
                    </arguments>
                    <properties>
                        <item name="port">%{jetty.server.port}</item>
                    </properties>
                </bean>
            </item>
            <item name="handler">
                <bean class="org.eclipse.jetty.server.handler.HandlerCollection">
                    <properties>
                        <item name="handlers" type="array">
                            <value>#{jetty.gzipHandler}</value>
                            <value>#{jetty.requestLogHandler}</value>
                        </item>
                    </properties>
                </bean>
            </item>
        </properties>
    </bean>

    <bean id="jetty.gzipHandler" class="org.eclipse.jetty.server.handler.gzip.GzipHandler" scope="prototype">
        <properties>
            <item name="minGzipSize" valueType="int">%{jetty.gzip.minGzipSize}</item>
            <item name="inflateBufferSize" valueType="int">%{jetty.gzip.inflateBufferSize}</item>
            <item name="deflaterPoolCapacity" valueType="int">%{jetty.gzip.deflaterPoolCapacity}</item>
            <item name="syncFlush" valueType="boolean">%{jetty.gzip.syncFlush}</item>
            <item name="includedMethodList">%{jetty.gzip.includedMethodList}</item>
            <item name="excludedMethodList">%{jetty.gzip.excludedMethodList}</item>
            <item name="handler">#{jetty.handlerCollection}</item>
        </properties>
    </bean>

    <bean id="jetty.handlerCollection" class="org.eclipse.jetty.server.handler.HandlerCollection" scope="prototype">
        <properties>
            <item name="handlers" type="array">
                <bean class="org.eclipse.jetty.server.handler.ContextHandlerCollection">
                    <properties>
                        <item name="handlers" type="array">
                            <bean class="com.aspectran.jetty.JettyWebAppContext">
                                <properties>
                                    <item name="contextPath">/</item>
                                    <item name="war">#{basePath}/webapps/root</item>
                                    <item name="persistTempDirectory" valueType="boolean">true</item>
                                    <item name="defaultsDescriptor">#{basePath}/config/server/jetty/webdefault.xml</item>
                                    <item name="sessionHandler">#{jetty.sessionHandler}</item>
                                    <item name="derived" valueType="boolean">true</item>
                                </properties>
                            </bean>
                        </item>
                    </properties>
                </bean>
                <bean class="org.eclipse.jetty.server.handler.DefaultHandler"/>
            </item>
        </properties>
    </bean>

    <bean id="jetty.sessionHandler" class="com.aspectran.jetty.JettySessionHandler" scope="prototype">
        <properties>
            <item name="sessionDataStore">
                <bean class="org.eclipse.jetty.server.session.FileSessionDataStoreFactory">
                    <properties>
                        <item name="storeDir" valueType="file">%{jetty.session.dataStoreDir}</item>
                        <item name="deleteUnrestorableFiles" valueType="boolean">true</item>
                    </properties>
                </bean>
            </item>
        </properties>
    </bean>

    <bean id="jetty.requestLogHandler" class="org.eclipse.jetty.server.handler.RequestLogHandler" scope="prototype">
        <properties>
            <item name="requestLog">
                <bean class="org.eclipse.jetty.server.CustomRequestLog">
                    <arguments>
                        <item>
                            <bean class="org.eclipse.jetty.server.AsyncRequestLogWriter">
                                <arguments>
                                    <item>#{basePath}/logs/jetty-yyyy_mm_dd.request.log</item>
                                </arguments>
                                <properties>
                                    <item name="filenameDateFormat">yyyy_MM_dd</item>
                                    <item name="retainDays" valueType="int">90</item>
                                    <item name="append" valueType="boolean">true</item>
                                    <item name="timeZone">GMT+9</item>
                                </properties>
                            </bean>
                        </item>
                        <item tokenize="false">%{client}a - %u %{yyyy-MM-dd HH:mm:ss ZZZ|GMT+9}t "%r" %s %O "%{Referer}i" "%{User-Agent}i"</item>
                    </arguments>
                </bean>
            </item>
        </properties>
    </bean>

</aspectran>