<?xml version="1.0" encoding="UTF-8"?>
<!DOCTYPE aspectran PUBLIC "-//ASPECTRAN//DTD Aspectran Configuration 6.0//EN"
        "http://aspectran.github.io/dtd/aspectran-6.dtd">
<aspectran>

    <translet name="/examples/hello-world">
        <echo id="page">
            <attributes>
                <item name="headline">Hello, World!</item>
                <item name="teaser">
                    This is the output of a JSP page that is part
                    of the HelloWorld application.
                </item>
                <item name="include">examples/hello-world</item>
            </attributes>
        </echo>
        <dispatch name="templates/default"/>
    </translet>

</aspectran>