<?xml version="1.0" encoding="UTF-8"?>
<!DOCTYPE aspectran PUBLIC "-//ASPECTRAN//DTD Aspectran 6.0//EN"
        "http://aspectran.github.io/dtd/aspectran-6.dtd">
<aspectran>

    <description>
        Aspectran's AOP is simple and powerful.
    </description>

    <bean scan="com.aspectran.aop.*TestActivity"/>

    <bean scan="com.aspectran.aop.*TestBean"/>

    <bean scan="com.aspectran.aop.*Aspect"/>

    <bean id="simpleAopTestAdvice" class="com.aspectran.aop.SimpleAopTestAdvice"/>

    <aspect id="aspect01" order="1" disabled="false">
        <joinpoint>
            pointcut: {
                +: aop/test/*
            }
        </joinpoint>
        <advice bean="simpleAopTestAdvice">
            <before>
                <invoke method="begin"/>
            </before>
            <after>
                <invoke method="end"/>
            </after>
            <finally>
                <thrown>
                    <invoke method="thrown"/>
                </thrown>
                <invoke method="close"/>
            </finally>
        </advice>
        <exception>
            <thrown>
                <action bean="simpleAopTestAdvice" method="globalExceptionHandling"/>
            </thrown>
        </exception>
    </aspect>

    <bean id="instantActivityAopTestAdvice" class="com.aspectran.aop.InstantActivityAopTestAdvice"/>

    <aspect id="aspect03" order="1" disabled="false">
        <joinpoint>
            pointcut: {
                +: **@class:com.aspectran.aop.InstantActivityTestBean
            }
        </joinpoint>
        <advice bean="instantActivityAopTestAdvice">
            <before>
                <invoke method="begin"/>
            </before>
            <after>
                <invoke method="end"/>
            </after>
            <finally>
                <thrown>
                    <invoke method="thrown"/>
                </thrown>
                <invoke method="close"/>
            </finally>
        </advice>
        <exception>
            <thrown>
                <action bean="simpleAopTestAdvice" method="globalExceptionHandling"/>
            </thrown>
        </exception>
    </aspect>

</aspectran>