<?xml version="1.0" encoding="utf-8"?>
<!DOCTYPE aspectran PUBLIC "-//ASPECTRAN//DTD Aspectran Configuration 6.0//EN"
        "http://aspectran.github.io/dtd/aspectran-6.dtd">
<aspectran>

    <description style="apon">
        |
        |Commands that can run the examples:
        |   hello     Runs the helloWorld() method of the sampleAction bean and prints the returned value to the console.
        |   echo      It accepts parameters and print them to the console.
        |   login     It accepts parameters used for login and print them to the console.
        |   chpw      It accepts parameters for changing the password and print them to the console.
        |   free      It uses the Freemarker template engine to output the values of the input parameters to the console.
        |   select    This example generates a simple SQL SELECT statement using the Freemarker template engine.
        |   update    This example generates a simple SQL UPDATE statement using the Freemarker template engine.
        |
    </description>

    <bean id="sampleAction" class="com.aspectran.shell.jline.sample.SampleAction">
        <description>
            Defines one sample action that contains the helloWorld method.
        </description>
    </bean>

    <bean id="sampleAdvice" class="com.aspectran.shell.jline.sample.SampleAdvice">
        <description>
            Defines the Advice Bean that has the Advice Method to be injected before and after the Action Method.
        </description>
    </bean>

    <aspect id="sampleAdviceAspect">
        <description>
            If a Translet that executes the helloWorld method of the sampleAction bean is found,
            executes the welcome() method of the sampleAdvice bean before executing the translet,
            and executes the goodbye() method of the sampleAdvice bean after executing the translet.
        </description>
        <joinpoint target="translet">
            pointcut: {
                +: hello@sampleAction^helloWorld
            }
        </joinpoint>
        <advice bean="sampleAdvice">
            <before>
                <action method="welcome"/>
            </before>
            <after>
                <action method="goodbye"/>
            </after>
        </advice>
    </aspect>

    <translet name="hello">
        <description style="apon">
            |
            |   Runs the helloWorld() method of the sampleAction bean and prints the returned value to the console.
            |   Maybe the words "Hello, World." will be printed on the console.
            |   Is it difficult to find the words "Hello, World." printed on the console?
            |   If so, try running the "hello2" command.
            |---------------------------------------------------------------------------------------------------------
        </description>
        <transform type="transform/text">
            <action id="helloData" bean="sampleAction" method="helloWorld"/>
        </transform>
    </translet>

    <translet name="echo1">
        <description style="apon">
            |It accepts parameters and print them to the console.
        </description>
        <parameters>
            <item name="param1" mandatory="false"/>
            <item name="param2" mandatory="true"/>
        </parameters>
        <transform type="transform/text">
            <template engine="token" style="apon">
                |----------------------------------------------------------
                |The parameters you entered are:
                |   param1: ${param1}
                |   param2: ${param2}
                |----------------------------------------------------------
            </template>
        </transform>
    </translet>

    <translet name="echo2">
        <description style="apon">
            |
            |   It accepts parameters and print them to the console.
            |
        </description>
        <parameters>
            <item name="param1" mandatory="true">${prefix} - 1</item>
            <item name="param2">${prefix} - 2</item>
            <item name="param3">${prefix} - 3</item>
        </parameters>
        <transform type="transform/text">
            <template engine="token" style="apon">
                |----------------------------------------------------------
                |The parameters you entered are:
                |   param1: ${param1}
                |   param2: ${param2}
                |   param3: ${param3}
                |----------------------------------------------------------
            </template>
        </transform>
    </translet>

    <translet name="echo3">
        <description style="apon">
            |
            |   It accepts parameters and print them to the console.
            |
        </description>
        <parameters>
            <item name="param1">first ${param1:12345}</item>
            <item name="param2">second ${param2:67890}</item>
            <item name="param3" mandatory="true">third ${param3-1} and ${param3-2}</item>
        </parameters>
        <attributes>
            <item name="attr1">fourth ${param4}</item>
        </attributes>
        <transform type="transform/text">
            <template engine="token" style="apon">
                |----------------------------------------------------------
                |The input parameters and attributes are as follows:
                |   param1: ${param1}
                |   param2: ${param2}
                |   param3: ${param3}
                |   attr1: @{attr1}
                |----------------------------------------------------------
            </template>
        </transform>
    </translet>

    <translet name="echo ${text}">
        <transform type="transform/text">
            <template engine="token" style="apon">
                |----------------------------------------------------------
                |${text}
                |----------------------------------------------------------
            </template>
        </transform>
    </translet>

    <translet name="login">
        <description style="apon">
            |
            |   If you enter the required ID and password for login, it will be printed on the console.
            |
        </description>
        <request>
            <parameters>
                <item name="email">${emailId}@${emailDomain}</item>
                <item name="password" secret="true"/>
            </parameters>
        </request>
        <transform type="transform/text">
            <template style="apon">
                |-----------------------------------------
                | You entered the following for login:
                |   email: ${email}
                |   password: ${password}
                |-----------------------------------------
            </template>
        </transform>
    </translet>

    <translet name="chpw">
        <description style="apon">
            |
            | If you enter parameters to change the password, it will be printed on the console.
            |
        </description>
        <request>
            <parameters>
                <item name="email">${emailId}@${emailDomain}</item>
                <item name="password" secret="true"/>
                <item name="confirmPassword" secret="true"/>
            </parameters>
        </request>
        <transform type="transform/text">
            <template style="apon">
                |--------------------------------------------------------
                | You entered the following to change your password:
                |   email: ${email}
                |   password: ${password}
                |   confrim password: ${confirmPassword}
                |--------------------------------------------------------
            </template>
        </transform>
    </translet>

    <append resource="config/shell/jline/freemarker-translets.xml"/>

</aspectran>