<?xml version="1.0" encoding="UTF-8"?>
<!DOCTYPE aspectran PUBLIC "-//ASPECTRAN//DTD Aspectran Configuration 6.0//EN"
        "http://aspectran.github.io/dtd/aspectran-6.dtd">
<aspectran>

    <description>
        An Aspectran configuration for the Web Application.
        Note that names of translets that match the request URI
        always start with a forward slash (/).
    </description>

    <bean id="jspViewDispatcher" class="com.aspectran.web.support.view.JspViewDispatcher">
        <description>
            Register a JSP View Dispatcher.
        </description>
        <properties>
            <item name="prefix">/WEB-INF/jsp/</item>
            <item name="suffix">.jsp</item>
        </properties>
    </bean>

    <aspect id="transletSettings">
        <description>
            Specifies the environment variables used during request and response processing.
        </description>
        <joinpoint target="translet"/>
        <settings>
            <setting name="characterEncoding" value="utf-8"/>
            <setting name="viewDispatcher" value="jspViewDispatcher"/>
            <setting name="indentString" value="  "/>
        </settings>
    </aspect>

    <append file="/config/web/home/main.xml"/>
    <append file="/config/web/examples/hello-world.xml"/>
    <append file="/config/web/examples/gs-rest-service.xml"/>
    <append file="/config/web/examples/file-upload.xml"/>
    <append file="/config/web/terminal/translet-interpreter.xml"/>

</aspectran>