<?xml version="1.0" encoding="UTF-8"?>
<!DOCTYPE aspectran PUBLIC "-//ASPECTRAN//DTD Aspectran 6.0//EN"
        "http://aspectran.github.io/dtd/aspectran-6.dtd">
<aspectran>

    <settings>
        <setting name="transletNameSuffix" value=".job"/>
    </settings>

    <bean id="*" scan="com.aspectran.embed.sample.**.*Advice" mask="com.aspectran.embed.**.*"/>
    <bean id="*" scan="com.aspectran.embed.service.**.*Advice" mask="com.aspectran.embed.**.*"/>
    <bean id="*" scan="com.aspectran.embed.sample.**.*Activity" mask="com.aspectran.embed.**.*"/>
    <bean id="*" scan="com.aspectran.embed.service.**.*Activity" mask="com.aspectran.embed.**.*"/>

    <bean id="defaultScheduler1" class="com.aspectran.core.scheduler.support.QuartzSchedulerFactoryBean" lazyInit="true">
        <properties>
            <item type="properties" name="quartzProperties">
                <entry name="org.quartz.scheduler.instanceName">AspectranQuartzScheduler-1</entry>
                <entry name="org.quartz.scheduler.rmi.export">false</entry>
                <entry name="org.quartz.scheduler.rmi.proxy">false</entry>
                <entry name="org.quartz.scheduler.wrapJobExecutionInUserTransaction">false</entry>
                <entry name="org.quartz.threadPool.class">org.quartz.simpl.SimpleThreadPool</entry>
                <entry name="org.quartz.threadPool.threadCount">10</entry>
                <entry name="org.quartz.threadPool.threadPriority">5</entry>
                <entry name="org.quartz.threadPool.threadsInheritContextClassLoaderOfInitializingThread">true</entry>
                <entry name="org.quartz.jobStore.misfireThreshold">60001</entry>
                <entry name="org.quartz.jobStore.class">org.quartz.simpl.RAMJobStore</entry>
            </item>
        </properties>
    </bean>

    <bean id="schedulerFactory" class="org.quartz.impl.StdSchedulerFactory" lazyInit="true">
        <arguments>
            <item type="properties">
                <entry name="org.quartz.scheduler.instanceName">AspectranQuartzScheduler-2</entry>
                <entry name="org.quartz.scheduler.rmi.export">false</entry>
                <entry name="org.quartz.scheduler.rmi.proxy">false</entry>
                <entry name="org.quartz.scheduler.wrapJobExecutionInUserTransaction">false</entry>
                <entry name="org.quartz.threadPool.class">org.quartz.simpl.SimpleThreadPool</entry>
                <entry name="org.quartz.threadPool.threadCount">10</entry>
                <entry name="org.quartz.threadPool.threadPriority">5</entry>
                <entry name="org.quartz.threadPool.threadsInheritContextClassLoaderOfInitializingThread">true</entry>
                <entry name="org.quartz.jobStore.misfireThreshold">60000</entry>
                <entry name="org.quartz.jobStore.class">org.quartz.simpl.RAMJobStore</entry>
            </item>
        </arguments>
    </bean>

    <bean id="defaultScheduler2" factoryBean="schedulerFactory" factoryMethod="getScheduler" lazyInit="true"/>

    <schedule id="scheduler1">
        <scheduler bean="defaultScheduler1">
            <trigger type="simple">
                intervalInSeconds: 1
                repeatCount: 1
            </trigger>
        </scheduler>
        <job translet="job1.job"/>
    </schedule>

    <schedule id="scheduler2">
        <scheduler bean="defaultScheduler2">
            <trigger type="simple">
                startDelaySeconds: 0
                intervalInSeconds: 1
                repeatCount: 1
            </trigger>
        </scheduler>
        <job translet="job2.job"/>
    </schedule>

    <translet name="job1">
        <action bean="sample.schedule.ScheduleActivity" method="delay">
            <arguments>
                <item valueType="long">1</item>
            </arguments>
        </action>
        <transform format="text" contentType="text/plain">
            <template>(1) Hello, World!</template>
        </transform>
    </translet>

    <translet name="job2">
        <action bean="sample.schedule.ScheduleActivity" method="delay">
            <arguments>
                <item valueType="long">2</item>
            </arguments>
        </action>
        <transform format="text" contentType="text/plain">
            <template>(2) Hello, World!</template>
        </transform>
    </translet>

</aspectran>